<?xml version="1.0" encoding="UTF-8"?>
<!-- XML Sample Message of message hierarchy                                          -->
<!-- Message:             ADC BAS Customized ACC Segment v1.0 Rev. 5                  -->
<!-- Transaction:         AA - Audit Data Collection Rev. 271                         -->
<!-- Datamodel:           Audit Data Collection Datamodel, version HEAD Rev. 347      -->
<!-- XML tagset used:     AdcsML                                                      -->
<!-- Generated at:        02-05-2021 15:29:45                                         -->
<!-- Generated using:     EC-Design 2.5.0 (http://www.ec-design.nl)                   -->
<!-- Generated by:        Jan Vrijenhoek (Digitect)                                   -->
<!-- Organisation:        Digitect B.V. (Digitect)                                    -->
<!-- NOTE:    This sample message was generated automatically: manual modifications will be lost -->
<AdcBasCustomizedAccSegment xsi:schemaLocation="http://schemas.iso.org/AdcsML/Messages/AdcBasCustomizedAccSegment-v1 AdcBasCustomizedAccSegment-v1.0.xsd"
		xmlns="http://schemas.iso.org/AdcsML/Messages/AdcBasCustomizedAccSegment-v1"
		xmlns:xsi="http://www.w3.org/2001/XMLSchema-instance">
	<BasCstmzdAccSg>
		<CstmzdAccSgCd>AS1</CstmzdAccSgCd>
		<CstmzdAccSgNm>Planned sales and purchase.</CstmzdAccSgNm>
		<CstmzdAccDscr>Annual plan.</CstmzdAccDscr>
		<CstmzdAccEncRule>1-2-2</CstmzdAccEncRule>
		<HrchyFlag>false</HrchyFlag>
		<ActiveFlag>true</ActiveFlag>
	</BasCstmzdAccSg>
</AdcBasCustomizedAccSegment>
